{"_meta": {"api_version": "1", "contract_version": "1.16", "generated_at": "2026-07-22T01:57:35+00:00", "provenance": "socrata", "data_tier": "mixed", "tier_note": "hearings/meetings are real (City Clerk eLMS); the activity summary is derived (counts over the topic-tagged council records, whose topic tagging is a derived best-effort classification).", "caveats": [{"code": "sponsorship_proxy_not_vote_tally", "text": "Council sponsorship counts are a proxy for engagement, not a roll-call vote tally \u2014 most Chicago street-safety measures pass by voice vote with no individual vote recorded."}], "license": "City of Chicago Data Portal Terms of Use (data.cityofchicago.org); derived analyses by On Your Left!", "attribution": "On Your Left! \u2014 Chicago bike safety, on the record (https://github.com/jartinator/chicago-safe-streets-data)", "human_page": "https://jartinator.github.io/chicago-safe-streets-data/action.html", "methodology": "https://jartinator.github.io/chicago-safe-streets-data/methodology.html", "schema": "https://jartinator.github.io/chicago-safe-streets-data/api/v1/schemas/council-index.schema.json"}, "hearings": {"as_of": "2026-07-22T01:56:32+00:00", "note": "Meetings from the City Clerk eLMS public API (api.chicityclerkelms.chicago.gov), refreshed each pipeline run; best-effort \u2014 verify against the official calendar before attending.", "structured_data_available": true, "committees": [{"committee": "Committee on Pedestrian and Traffic Safety", "calendar_url": "https://chicityclerkelms.chicago.gov/Meetings?body=Committee+on+Pedestrian+and+Traffic+Safety", "meeting_count": 0, "meetings": []}, {"committee": "Committee on Transportation and Public Way", "calendar_url": "https://chicityclerkelms.chicago.gov/Meetings?body=Committee+on+Transportation+and+Public+Way", "meeting_count": 0, "meetings": []}], "source": "elms_api"}, "activity_summary": {"topic_relevant_matters": 223, "by_status": {"Introduced": 13, "Passed": 171, "Substituted": 1, "Failed to Pass": 32, "Adopted": 4, "Placed on File": 2}, "by_type": {"resolution": 4, "ordinance": 11, "bill": 1, "Resolution": 11, "Ordinance": 173, "Order": 15, "Communication": 1, "Claim": 7}, "most_recent_intro_date": "2026-07-15", "note": "Merged from two sources: the Legistar Web API (historical, through 2023-06-21) and DataMade's Chicago Councilmatic mirror (current through 2026-07-15), which covers the period after Chicago's council left Legistar. Each record carries a `source`. recorded_votes appears only on the rare bills with a recorded roll-call split \u2014 most council actions pass by voice vote. sponsor_wards resolves only when a sponsor's name exactly matches a manually-filled entry in aldermen.json; empty means unresolved, not 'no sponsors'. topic_relevant/topic_reason are automated tags (topic_tag_tier: derived) \u2014 see topic_tagged_by ('llm' vs 'keyword_fallback')."}, "records_url": "https://jartinator.github.io/chicago-safe-streets-data/api/v1/council/records.json", "aldermen_url": "https://jartinator.github.io/chicago-safe-streets-data/api/v1/council/aldermen.json"}